name,description,price,imageUrl
Women's White Open-Toe Slip-On Sandals,"These women's white open-toe slip-on sandals offer ultimate comfort and a minimalist design, perfect for lounging or casual warm-weather outings. Their simple yet ergonomic shape makes them a versatile addition to any relaxed wardrobe. Style Vibe: Casual Comfort / Spa-like Serenity. Fit: Slip-on style, wide strap for comfort. Material: EVA foam or rubber. Care: Wipe clean with a damp cloth. Matches Well With: Attire: Loungewear, casual shorts, swimwear, or simple dresses. Colors: Neutrals, pastels, or any casual outfit.",$30.00,Image99.jpg
Men's Black and White High-Top Sneakers,"These men's black and white high-top sneakers feature a bold, two-tone design with a chunky sole, offering a modern and sporty look. Ideal for streetwear and casual outfits, they provide ankle support and a contemporary edge. Style Vibe: Streetwear / Sporty Chic. Fit: High-top for ankle support, lace-up for adjustable fit. Material: Synthetic leather and mesh with a rubber sole. Care: Wipe clean with a damp cloth. Matches Well With: Attire: Jeans, joggers, cargo pants, or oversized casual wear. Colors: Black, white, grey, or contrasting bright colors.",$70.00,Image100.jpg
Silver-Tone Textured Bracelet Set,"This set of seven silver-tone bracelets features a variety of textures and patterns, including hammered, twisted, and engraved designs. Perfect for stacking, they add a bohemian yet chic touch to any outfit, offering versatile styling options. Style Vibe: Bohemian Chic / Eclectic Glam. Fit: Various sizes, designed for stacking. Material: Silver-tone metal alloy. Care: Avoid moisture, wipe clean with a dry cloth. Matches Well With: Attire: Casual dresses, blouses, jeans, or other jewelry. Colors: Pairs well with any color palette.",$25.00,Image101.jpg
Layered Gold and Silver Chain Bracelet Set,"This elegant 5-piece bracelet set features a mix of gold and silver-tone chains with varying textures, including a rope chain, Figaro chain, and snake chain. Designed for a layered look, they add a sophisticated and trendy touch to any ensemble. Style Vibe: Modern Chic / Layered Elegance. Fit: Adjustable, designed for a layered fit. Material: Stainless steel with gold and silver plating. Care: Avoid moisture, wipe clean with a dry cloth. Matches Well With: Attire: Dresses, blouses, sweaters, or any outfit needing a touch of refined jewelry. Colors: Pairs well with both cool and warm tones.",$30.00,Image102.jpg
Men's Black Braided Leather Bracelet Set with Skull and Star Accents,"This 6-piece men's bracelet set features a variety of black braided leather designs, adorned with skull, star, and metal ring accents. Perfect for adding a bold, punk-rock edge to any look, these adjustable bracelets offer a rugged and distinctive style. Style Vibe: Punk Rock / Edgy Casual. Fit: Adjustable, multi-layered design. Material: Braided leather, metal alloy. Care: Avoid moisture, wipe clean with a dry cloth. Matches Well With: Attire: Leather jackets, denim, band t-shirts, or casual streetwear. Colors: Black, grey, dark denim, or military green.",$28.00,Image103.jpg
Adjustable Blue Braided Friendship Bracelet,"This adjustable blue braided friendship bracelet features varying shades of blue, creating a vibrant and casual accessory. Its simple, handmade look makes it a perfect everyday piece or a thoughtful gift, embodying a laid-back, summery vibe. Style Vibe: Casual / Bohemian / Friendship. Fit: Adjustable knot closure. Material: Woven string/thread. Care: Hand wash gently, air dry. Matches Well With: Attire: Casual wear, beachwear, summer dresses, or jeans. Colors: Denim, white, other blues, or earthy tones.",$8.00,Image104.jpg
Brown Straw Boater Hat with Black and White Ribbon and M Detail,"This stylish brown straw boater hat features a flat top and brim, accented with a chic black and white ribbon band and a prominent 'M' detail. Perfect for sunny days, it adds a touch of classic sophistication and resort-wear elegance to any outfit. Style Vibe: Classic Chic / Resort Wear. Fit: Standard fit for adults. Material: Woven straw with fabric ribbon. Care: Spot clean only, avoid crushing. Matches Well With: Attire: Sundresses, wide-leg pants, swimwear, or linen outfits. Colors: Neutrals, black, white, and earthy tones.",$45.00,Image105.jpg
Precision Micro-Print Slim Shirt   White/Navy,"This refined micro-print button-down shirt brings crisp precision to everyday tailoring, catching the eye with its subtle geometric motif while staying resolutely sleek and professional. Style Vibe: Modern Professional / Smart-Casual Sophistication. Fit: Trim, sculpted slim fit tapered through the torso and sleeves to sharpen the silhouette while allowing comfortable movement. Material: 97% long-staple cotton, 3% elastane; breathable poplin woven with a navy micro-dot repeat for understated texture and gentle stretch. Care: Machine-wash cold on a gentle cycle; hang dry or tumble low and give a quick press for a perfectly crisp finish. Matches Well With: Bottoms: Ink-navy wool trousers for boardroom polish, charcoal chinos for business-casual ease, or dark selvedge denim for refined off-duty style. Outerwear: An unstructured grey blazer to keep things light yet tailored, or a slim bomber jacket in espresso suede for a relaxed luxe contrast. Shoes: Classic brown or black cap-toe Oxfords at the office; minimalist white leather sneakers when dressing the look down. Accessories: A matte-black leather belt, a sleek stainless-steel dress watch, and a pocket square that picks up a hint of the navy micro-print for subtle coordination.",$79.90,Image106.jpg
Shoreline Linen Wedding Suit  Sand Beige,"This lightweight two-piece linen suit is purpose-built for beach ceremonies, balancing relaxed comfort with refined polish so you look effortlessly sharp against sun-kissed waves. Style Vibe: Coastal Formal / Destination Elegance. Fit: Relaxed-tailoredsoftly structured shoulders, easy drape through the torso, and straight-leg trousers that move freely when strolling seaside. Material: 98 % breathable flax linen, pre-washed for softness and a naturally slubbed texture that keeps you cool in tropical climates. Care: Dry-clean or hand-wash cold; hang to dry and steam lightly to restore its crisp shape. Matches Well With: Shirts: Open-collar white cotton-linen shirt for airy sophistication or a pastel band-collar linen shirt to echo ocean hues. Footwear: Tan leather loafers, woven espadrilles, or barefoot in the sand for laid-back vows. Accessories: A braided leather belt, straw Panama hat, tropical boutonnire, and a simple silver divers watch to complete the breezy wedding ensemble.",$249.90,Image107.jpg
Seabreeze Linen Waistcoat Set  Dove Grey,"This breathable linen-cotton waistcoat ensemble is purpose-styled for sun-kissed beach weddings, fusing rolled-sleeve ease with crisp coastal refinement so you stay cool and polished from aisle to shoreline. Style Vibe: Rustic Garden / Coastal Ceremony. Fit: Slim yet relaxed through the torso for natural movement when mingling on sand or grass. Material: 55 % linen, 45 % cotton chambray; the airy weave wicks moisture while delivering a soft, tactile texture. Care: Dry-clean or gentle cold wash; hang dry and steam lightly to revive its structure. Matches Well With: Shirts: Open-collar white poplin, pale blue Oxford, or a linen band-collar shirt for seaside casual. Trousers: Sand chinos, light-grey linen trousers, or tailored shorts for a barefoot beachfront vibe. Shoes: Tan suede loafers, woven espadrilles, or simply barefoot in the sand. Accessories: Sky-blue silk tie, tropical boutonnire, braided leather belt, and a straw Panama hat to keep the sun at bay",$109.90,Image108.jpg
Coastal Ceremony Chino Shorts  Sandstone,"This tailored cotton-stretch chino short keeps things polished yet breezy for destination beach weddings, offering a crisp mid-thigh cut that pairs elegantly with rolled-sleeve shirts and bare ankles in the sand. Style Vibe: Coastal Casual / Smart Resort. Fit: Mid-rise, slim leg that ends just above the knee for easy movement and contemporary proportion. Material: 98 % cotton, 2 % elastane twill lightweight, breathable, and softly brushed for all-day comfort. Care: Machine-wash cold, tumble low; a light press restores its sharp lines. Matches Well With: Shirtswhite linen button-down or pastel band-collar; Footwearwoven leather loafers, espadrilles, or simply barefoot on the shore; Accessoriestan braided belt, unstructured linen blazer, and a tropical boutonnire for seaside vows.",$59.90,Image109.jpg
Tidewhite Relaxed Linen Set  Classic White,"This all-white two-piece linen set captures the essence of barefoot elegance, making it a top choice for beach weddings where laid-back comfort meets timeless charm. Style Vibe: Bohemian Coastal / Island Wedding Ready. Fit: Relaxed through the body and leg, with a breezy silhouette designed for airflow and freedom of movement on sandy shores. Material: 100 % breathable linen-blend fabric lightweight, lightly textured, and naturally cooling for tropical heat. Care: Machine-wash cold, hang dry; light steam to smooth out any creases and keep the look crisp. Matches Well With: Accessoriestropical boutonnire, beaded bracelet, or straw Panama hat. Footwearbarefoot, white espadrilles, or tan leather sandals. Outerweara lightweight linen blazer for semi-formal appeal or left as-is for a beach-casual vow exchange.",$84.90,Image110.jpg
Regatta Crest Beach Blazer Set  Navy & White,"This yacht-clubinspired blazer ensemble brings polished nautical flair to beach weddings, pairing a slim navy single-breasted jacket adorned with a gold crest and crisp white stretch chinos for a striking shoreline silhouette. Style Vibe: Coastal Formal / Riviera Chic. Fit: Tailored slim through shoulders and waist with unstructured construction for breezy movement, ankle-skimming chinos cut slim for modern proportion. Material: Lightweight linen-cotton-blend blazer lined in breathable mesh, stretch cotton twill trousers that stay cool under the sun. Care: Dry-clean blazer, machine-wash cold chinos; steam lightly to maintain sharp lines. Matches Well With: Shirtssky-blue open-collar poplin, white linen band-collar, or a striped Breton tee for the reception. Footweartan suede espadrilles, woven loafers, or simply barefoot on the sand. Accessoriesa woven leather belt, nautical pocket square, straw Panama hat, and a citrus boutonnire to accent coastal hues.",$179.90,Image111.jpg
Thai Heritage Elephant Harem Pants  Teal Ivory,"These iconic Thailand elephant pants celebrate Southeast-Asian artistry with intricate ivory elephant and mandala motifs woven across cool teal rayon, delivering lightweight freedom for beach strolls, yoga, or laid-back travel. Style Vibe: Boho Nomad / Tropical Chill. Fit: Unisex relaxed harem cut with smocked drawstring waistband and elastic ankle cuffs for effortless drape and secure, move-friendly comfort. Material: Feather-light 100 % rayon sourced in northern Thailandsilky, breathable, and quick-drying for humid climates. Care: Machine-wash cold on gentle; hang dry to preserve color vibrancy and softness. Matches Well With: Topswhite linen tanks, cropped tees, or bikini tops for seaside lounging; Footwearbarefoot in the sand, simple leather sandals, or canvas espadrilles; Accessorieswoven straw hat, beaded bracelets, and a macram tote for authentic wanderer flair",$34.90,Image112.jpg
Sukhothai Elephant Palazzo Pants  Black & Ivory,"These authentic Thailand elephant pants feature hand-drawn motifs inspired by ancient Thai temples and wildlife, woven into breathable rayon for a look thats equal parts cultural and effortlessly chic. Style Vibe: Southeast Asian Boho / Temple-to-Tide Comfort. Fit: High-rise relaxed palazzo cut with wide legs and a drawstring-smocked waistband for flattering ease and all-day flow. Material: 100 % Thai rayon soft, lightweight, and naturally cooling in tropical heat. Care: Machine-wash cold; hang dry to maintain the fabrics drape and rich detail. Matches Well With: Topscropped tanks, loose linen shirts, or bikini tops for beach weddings and retreats; Footwearstrappy leather sandals, barefoot on bamboo decks, or espadrilles. Accessorieswoven bangles, a rattan crossbody bag, or a cotton scarf for sunset coverage.",$36.90,Image113.jpg
Chiang Mai Elephant Harem Pants  Ruby Ivory,"These authentic Thailand elephant pants burst with vivid ruby red and ivory motifs of sacred elephants and lotus mandalas, celebrating Northern Thai artistry while keeping you cool from dawn yoga to dusk beach walks. Style Vibe: Boho Nomad / Island Chill. Fit: Unisex relaxed harem cut with a smocked drawstring waist and soft elastic cuffs for effortless drape and stay-put comfort. Material: Feather-light 100 % Thai rayonsilky, breathable, and quick-drying in tropical heat. Care: Machine-wash cold on gentle; hang dry to lock in color vibrancy and softness. Matches Well With: Topswhite linen crops, relaxed tanks, or swim tops; Footwearbarefoot in the sand, leather sandals, or canvas slip-ons; Accessoriesstraw sun-hat, beaded bracelets, and a macram crossbody for carefree wanderer energy.",$34.90,Image114.jpg
Phuket Jungle Elephant Pants  Midnight Indigo,"Straight from the street markets of Thailand, these bold elephant pants blend cultural symbolism with tropical spiritfeaturing sacred elephant processions, jungle leaves, and tribal florals in a deep indigo hue that feels both earthy and expressive. Style Vibe: Thai Boho / Nature Escape. Fit: Relaxed wide-leg cut with a high-rise smocked drawstring waistband and flexible ankle hem for easy flow and everyday wear. Material: 100 % Thai rayonlightweight, ultra-soft, and ideal for hot, humid days. Care: Machine-wash cold; hang dry to retain shape, color, and comfort. Matches Well With: Topsblack crop tops, simple tanks, or breezy halters; Footwearbarefoot, strappy flats, or boho wedges for casual elevation; Accessoriesbamboo bangles, beaded anklets, and a canvas sling bag for an effortless, wanderlust-ready vibe.",$36.90,Image115.jpg
Elephant Festival Camp Shirt  Onyx Ivory,"This breezy Thai rayon camp-collar shirt bursts with iconic elephant processions and lotus mandalas, designed to sync seamlessly with matching elephant pants for an effortlessly cohesive, culture-rich look. Style Vibe: Island Festival / Boho Street. Fit: Relaxed drape with a boxy cut and soft camp collarideal for layering or wearing open over swimwear. Material: Feather-light 100 % Thai rayoncool, quick-drying, and silky against sun-kissed skin. Care: Machine-wash cold on gentle; hang dry to keep prints crisp and fabric flowing. Matches Well With: Elephant Pantspair with coordinating Thai elephant harem or palazzo pants for a head-to-toe statement set; Footwearleather sandals, espadrilles, or barefoot on the sand; Accessorieswoven straw hat, vintage shades, layered beaded necklaces for festival-ready flair.",$32.90,Image116.jpg
Chiang Rai Elephant Camp Shirt  Indigo Ivory,"This lightweight Thai rayon camp-collar shirt showcases marching elephant and paisley borders in rich indigo and ivory, designed to partner perfectly with matching elephant pants for a head-to-toe heritage set. Style Vibe: Boho Traveler / Festival Ease. Fit: Relaxed boxy drape with rolled-friendly short sleeves and a fluid hem that hangs clean over harem or palazzo silhouettes. Material: Feather-light 100 % Thai rayoncool, quick-drying, and soft against sun-warmed skin. Care: Machine-wash cold on gentle; hang dry to keep the print crisp and fabric flowing. Matches Well With: Coordinating Thailand elephant pants for a seamless two-piece look, tan leather sandals or barefoot on the beach, plus woven straw hat and layered beaded necklaces for effortless wanderer style",$34.50,Image117.jpg
Siam Spirit Elephant Shirt  Sapphire Black,"This bold elephant shirt channels traditional Thai symbolism through vibrant sapphire blue and black bands filled with majestic elephants, paisley swirls, and tribal motifscrafted to pair flawlessly with matching elephant pants for a complete cultural ensemble. Style Vibe: Thai Boho Fusion / Street-to-Sand Versatility. Fit: Relaxed camp-style cut with short sleeves, button-down front, and open collardesigned for breezy movement in tropical heat. Material: 100 % soft Thai rayonlightweight, breathable, and quick-drying for hot, humid days. Care: Machine-wash cold on gentle; hang dry to preserve the vibrancy and drape. Matches Well With: Matching Thailand elephant pants for a cohesive look, or contrast with solid black harem trousers. Add sandals, a wide-brim straw hat, and a few handmade bead bracelets to complete your festival or travel-ready outfit.",$24.50,Image118.jpg
Bangkok Royal Elephant Shirt  Crimson Black,"This striking elephant shirt features traditional Thai motifs in vivid crimson red and deep black, with intricately patterned elephants marching across every panelcrafted to pair seamlessly with matching elephant pants for a unified, culturally rich look. Style Vibe: Thai Heritage Bold / Festival Boho. Fit: Relaxed camp-collar silhouette with a button-up front, open short sleeves, and roomy comfort for warm-weather wear. Material: 100 % Thai rayonultra-lightweight, breathable, and soft for tropical climates and laid-back styling. Care: Machine-wash cold on gentle cycle; hang dry to maintain vibrant color and flowy feel. Matches Well With: Coordinating red or black Thai elephant pants for a full heritage outfit; sandals or barefoot for beach vibes; woven accessories like rattan crossbodies or beaded necklaces to enhance the traditional aesthetic",$25.20,Image119.jpg
Hack Day Matrix Tee  Black & White,"This bold tech-themed shirt is the ultimate go-to for hackathons and coding marathons, featuring a high-contrast white matrix-style print that proudly declares your commitment to innovation and caffeine-fueled creativity. Style Vibe: Geek Chic / Dev Culture Cool. Fit: Classic unisex crewneck cut with a relaxed fit for all-day comfort whether youre coding at a desk, whiteboarding ideas, or pitching your next big app. Material: 100 % ring-spun cottonsoft, breathable, and durable enough to survive back-to-back coding sprints. Care: Machine-wash cold, tumble dry low or hang dry to keep the graphic bold and crisp. Matches Well With: Dark jeans or joggers, a zip-up hoodie, headphones, and your favorite laptop backpackideal for both on-site hackathons and virtual dev events.",$24.90,Image120.jpg
Hack Life Tri-Blend Tee  Violet Burst,"This energizing hackathon shirt sparks creativity with its vibrant violet fabric and playful graphic of keyboards, coffee mugs, Wi-Fi icons, and pizza slicesperfectly capturing the caffeine-powered coding grind. Style Vibe: Dev-Culture Fun / Startup Casual. Fit: Classic unisex crewneck with an easy drape built for marathon brainstorming sessions. Material: Ultra-soft tri-blend (50 % polyester, 25 % combed ring-spun cotton, 25 % rayon) that stays breathable and keeps its shape through all-night sprints. Care: Machine-wash cold, tumble low; colors stay vivid and print stays sharp. Matches Well With: Joggers, dark jeans, zip-hoodies, noise-canceling cans, and a laptop plastered in stickerseverything you need to live and breathe code.",$23.20,Image121.jpg
Impact Hackathon Tech Tee  Circuit Black,"This sleek and futuristic hackathon shirt was designed for Campus Founders' 2020 Impact Hackathon, featuring high-voltage neon circuitry and bold type to match the energy of rapid prototyping and game-changing ideas. Style Vibe: Startup Techwear / Innovation-Ready. Fit: Athletic unisex cut with a smooth finishideal for pitch rooms, breakout sessions, and hacking through the night. Material: High-performance polyester blendlightweight, moisture-wicking, and quick-drying to handle the heat of both code and competition. Care: Machine-wash cold, tumble low; print stays sharp through every iteration. Matches Well With: Tech joggers or jeans, smart sneakers, a smartwatch, and a laptop bag packed with ambitionperfect for devs, founders, and digital creators pushing boundaries",$18.30,Image122.jpg
Intel Hackathon 2022 Hoodie Coder Tee  Midnight Black,"This bold hackathon shirt from Intels 2022 event features a striking silhouette of a hooded coder surrounded by glowing binarycapturing the mystery, focus, and adrenaline of overnight coding marathons. Style Vibe: Cyber Dev / Dark Mode Aesthetic. Fit: Classic unisex crewneck with a comfortable regular fitperfect for long hours in labs, sprints, or virtual hacking sessions. Material: 100 % soft-spun cottonbreathable and smooth against the skin, ideal for layering with a hoodie or flannel. Care: Machine-wash cold, inside out; tumble dry low to preserve the graphic edge and shape. Matches Well With: Joggers or black jeans, over-ear headphones, energy drinks, and the drive to build something epic before sunrise.",$17.25,Image123.jpg
LFC Sleeveless Training Jersey  Crimson Volt,"This official Liverpool FC sleeveless football shirt keeps you cool during high-intensity drills, featuring Nikes lightweight Dri-FIT fabric in iconic Anfield crimson with a volt-red AXA sponsor mark and the proud Liverbird crest. Style Vibe: Pro Pitch Performance / Street Sport Edge. Fit: Athletic slim cut with generous arm openings for full-range motion and extra airflow. Material: 100 % recycled polyester Dri-FIT knitmoisture-wicking, quick-drying, and feather-light for rigorous sessions. Care: Machine-wash cold, inside out; hang dry to preserve heat-transfer graphics and maintain shape. Matches Well With: Black or crimson training shorts, compression sleeves, turf boots, or layered over a long-sleeve base layer when temps drop",$54.90,Image124.jpg
Madrid 19 Final Tank  Spurs Edition,"This commemorative sleeveless football shirt celebrates Tottenham Hotspurs historic run to the 2019 UEFA Champions League Final in Madrid, featuring the iconic cockerel silhouette perched on a match ball in deep navy. Style Vibe: Heritage Fanwear / Summer Matchday Casual. Fit: Classic sleeveless tank top with a relaxed athletic cutperfect for warm-weather training, beach kickabouts, or repping your team in the off-season. Material: Soft 100% cotton jerseylightweight, breathable, and comfortable for everyday wear. Care: Machine-wash cold with like colors; tumble dry low to keep the graphic crisp and the cotton fresh. Matches Well With: Navy shorts or joggers, casual sneakers, and plenty of pridewhether you're reliving Madrid or kicking back during pre-season.",$29.90,Image125.jpg
Bara Sleeveless Training Jersey  Midnight Blaugrana,"This official FC Barcelona sleeveless football shirt lets you train with maximum airflow, featuring Nikes lightweight Dri-FIT knit in stealth black with the Spotify sponsor mark and the iconic crest, plus subtle blau-grana flashes at the shoulders for unmistakable club pride. Style Vibe: Pro Pitch Performance / Street Sport Edge. Fit: Athletic slim cut with deep arm openings for full-range motion during drills and gym sessions. Material: 100 % recycled polyester Dri-FITmoisture-wicking, quick-drying, and feather-light to keep you cool when the tempo rises. Care: Machine-wash cold, inside out; hang dry to preserve heat-transfer graphics and fabric integrity. Matches Well With: Black or blau-grana training shorts, compression sleeves, turf boots, or layered over a long-sleeve base layer on cooler days.",$65.90,Image126.jpg
PSG Sleeveless Training Jersey  Midnight Navy,"This official Paris Saint-Germain sleeveless football shirt is built for elite performance and Parisian flair, featuring the bold 'Accor Live Limitless' sponsor across a deep navy Nike Dri-FIT baseperfect for intense training in warm weather. Style Vibe: Elite Performance / Street-Smart Football. Fit: Athletic slim fit with wide armholes for unrestricted movement, ideal for drills, gym sessions, or match-day warmups. Material: 100% recycled polyester with Nike Dri-FIT technologymoisture-wicking, lightweight, and built for breathability under pressure. Care: Machine-wash cold, inside out; hang dry to preserve the crest, sponsor detailing, and shape. Matches Well With: PSG training shorts, compression gear, turf boots, and headphonesbecause every rep should feel like Parc des Princes intensity.",$54.90,Image127.jpg
Manchester United Sleeveless Training Jersey  Eclipse Navy,"This official Manchester United sleeveless football shirt delivers peak performance and Premier League energy, featuring the modern Tezos sponsor logo, adidas Aeroready tech, and signature red accents to honor Old Traffords legacy. Style Vibe: Pro Training / Modern Legacy. Fit: Athletic slim fit with wide-cut armholes to maximize airflow and allow full range of motion for elite drills or gym work. Material: 100% recycled polyester with adidas Aeroready fabricmoisture-absorbing, lightweight, and engineered for breathability. Care: Machine-wash cold, inside out; hang dry to preserve heat-pressed graphics and elite fit. Matches Well With: Matching MUFC training shorts, black compression tights, and white or red bootsbuilt for players and fans who train with purpose.",$34.30,Image128.jpg
