name,description,price,imageUrl
Men's Black and Grey Plaid Long-Sleeve Shirt,"This men's long-sleeve shirt features a classic black and grey plaid pattern, offering a timeless and versatile look. It has a traditional collar and full button-down front, perfect for layering over a t-shirt or wearing on its own for a casual yet put-together style. Style Vibe: Classic Casual / Grunge Inspired. Fit: Regular fit, long-sleeve, button-down. Material: Cotton flannel or blend. Care: Machine wash cold. Matches Well With: Inner Tops: A plain white t-shirt (as shown). Bottoms: Dark wash jeans or black chinos. Shoes: Combat boots or sneakers. Accessories: A dog tag necklace (as shown) or a beanie.",$48.00,Image58.jpg
Men's Olive Green Contrast Collar Polo Shirt,"This men's olive green polo shirt features a classic two-button placket and a contrasting light brown collar and sleeve trim, adding a refined touch to its athletic design. Its tailored fit and short sleeves make it a smart and comfortable choice for various casual and semi-casual occasions. Style Vibe: Sporty Elegant / Preppy Casual. Fit: Tailored fit, short-sleeve polo. Material: Pique knit cotton blend. Care: Machine wash cold. Matches Well With: Bottoms: Khaki chinos (as shown), dark jeans, or tailored shorts. Shoes: Loafers, boat shoes, or clean white sneakers. Accessories: A watch (as shown) or a leather bracelet.",$42.00,Image59.jpg
Men's Black Multi-Pocket Cargo Shorts,"These black men's cargo shorts feature an elasticated drawstring waist for comfort and a relaxed, knee-length fit. They are equipped with large, prominent side cargo pockets, one of which has a reflective strip, adding a modern utilitarian and streetwear edge. Style Vibe: Streetwear / Sporty Utility. Fit: Relaxed fit, knee-length, with adjustable drawstring waist. Material: Durable cotton or nylon blend. Care: Machine wash cold. Matches Well With: Tops: An oversized t-shirt (as shown) or a casual hoodie. Shoes: White chunky sneakers (as shown) or high-top trainers. Accessories: A silver bracelet (as shown) or a hip-hop inspired chain.",$50.00,Image60.jpg
Men's White Short-Sleeve Graphic T-Shirt,"This men's white short-sleeve t-shirt features a striking graphic print across the chest, possibly incorporating abstract elements or text, offering a modern and edgy streetwear aesthetic. The classic crew neck and comfortable fit make it a versatile piece for casual everyday wear or for making a statement. Style Vibe: Urban Streetwear / Artistic Casual. Fit: Regular fit, short-sleeve, crew neck. Material: Soft cotton jersey. Care: Machine wash cold, inside out. Matches Well With: Bottoms: Black loose-fit jeans (as shown) or dark wash denim. Outerwear: An open denim jacket or a bomber jacket. Shoes: Chunky sneakers (as shown) or high-top canvas shoes. Accessories: A simple chain necklace or a baseball cap.",$35.00,Image61.jpg
Men's White Wide-Shoulder Tank Top,"This men's white tank top is designed with wider shoulders than a typical tank, giving it a more substantial and modern athletic look. The clean, minimalist design and classic crew neck make it a versatile layering piece or a comfortable top for casual wear, especially in warmer weather. Style Vibe: Athleisure / Minimalist Casual. Fit: Regular fit, wide-shoulder tank. Material: Soft cotton blend. Care: Machine wash cold. Matches Well With: Bottoms: Black cargo pants (as shown) or athletic shorts. Outerwear: An open plaid shirt or a lightweight hoodie. Shoes: White sneakers or slides. Accessories: A sports watch or a simple silver necklace.",$28.00,Image62.jpg
Women's Blue Plaid Seven-Sleeve Top,"This women's blue plaid top features a relaxed, loose fit and unique seven-eighths sleeves that add a stylish and comfortable dimension. The classic plaid pattern in shades of blue and white gives it a timeless yet casual appeal, perfect for an effortless everyday look. Style Vibe: Casual Chic / Relaxed Academia. Fit: Loose fit, seven-eighths sleeves. Material: Soft cotton blend flannel. Care: Machine wash cold. Matches Well With: Bottoms: Light wash straight-leg jeans (as shown) or white wide-leg trousers. Shoes: White sneakers or comfortable loafers. Accessories: A simple cross-body bag or minimalist jewelry.",$45.00,Image63.jpg
Men's Oversized White Pinstripe Shirt,"This men's white long-sleeve shirt features subtle pinstripes and a distinctly oversized, relaxed fit, offering a contemporary and comfortable silhouette. It has a classic collar and full button-down front, designed to be worn casually, possibly half-tucked, for a laid-back yet stylish appearance. Style Vibe: Modern Casual / Relaxed Sophistication. Fit: Oversized, long-sleeve button-down. Material: Lightweight cotton blend. Care: Machine wash cold. Matches Well With: Bottoms: Light brown tailored trousers (as shown) or dark wash jeans. Shoes: White minimalist sneakers or loafers. Accessories: A simple watch or a leather belt.",$58.00,Image64.jpg
Men's Black Contrast Stitching Work Jacket,"This men's black work jacket offers a rugged yet stylish aesthetic, featuring distinctive white contrast stitching that highlights its seams and pockets. It has a classic collar, full zip closure, and multiple functional pockets, giving it a utilitarian workwear vibe perfect for a casual, edgy look. Style Vibe: Urban Workwear / Grunge Casual. Fit: Regular fit, structured. Material: Durable cotton canvas or twill. Care: Machine wash cold. Matches Well With: Tops: A plain white t-shirt (as shown) or a band tee. Bottoms: Grey cargo pants (as shown) or distressed black jeans. Shoes: Combat boots or high-top sneakers. Accessories: A beanie or a chunky silver ring.",$95.00,Image65.jpg
Men's Light Wash Baggy Denim Shorts,"These men's light wash denim shorts feature a noticeably baggy fit that extends to just above the knee, offering a comfortable and relaxed silhouette. The distressed detailing and classic denim wash give them a casual, vintage-inspired streetwear appeal, perfect for warm weather. Style Vibe: 90s Streetwear / Skater Casual. Fit: Baggy fit, knee-length. Material: Cotton denim. Care: Machine wash cold. Matches Well With: Tops: An oversized graphic t-shirt (as shown) or a relaxed-fit hoodie. Shoes: High-top canvas sneakers (as shown) or skate shoes. Accessories: A baseball cap or a chain wallet.",$50.00,Image66.jpg
Men's Blue Leaf Print Short-Sleeve Shirt,"This men's short-sleeve shirt features a light blue background with a white leaf print pattern, giving it a tropical and relaxed aesthetic. It has a classic collar and a full button-down front, designed to be worn casually open or closed. Style Vibe: Beach / Tropical / Resort Wear. Fit: Regular fit, short-sleeve button-down. Material: Lightweight fabric, possibly cotton or a blend suitable for warm weather. Care: Machine wash cold. Matches Well With: Bottoms: Light-colored shorts or chinos. Shoes: Sandals or boat shoes. Accessories: Sunglasses.",$48.00,Image67.jpg
Men's White Polo Shirt with Horse Logo,"This men's white polo shirt features a classic design with a black collar and black trim on the short sleeves. A black silhouette of a man on a horse is prominently displayed on the left chest. Style Vibe: Casual / Sporty. Fit: Regular fit polo shirt. Material: Cotton or a cotton blend. Care: Machine wash cold. Matches Well With: Bottoms: Jeans, chinos, or shorts. Shoes: Sneakers or casual loafers. Accessories: A watch.",$35.00,Image68.jpg
Men's Black and White Palm Tree Print Short-Sleeve Shirt,"This men's short-sleeve shirt is white with a bold black palm tree print, giving it a strong tropical and vacation-ready feel. It has a classic collar and a full button-down front, and it's styled open over a white t-shirt. Style Vibe: Hawaiian / Beach / Casual. Fit: Slim fit, short-sleeve button-down. Material: Lycra blend or similar lightweight fabric. Care: Machine wash cold. Matches Well With: Inner Tops: A plain white t-shirt (as shown). Bottoms: Shorts or light-colored trousers. Shoes: Sandals or casual sneakers. Accessories: A long necklace (as shown).",$45.00,Image69.jpg
Men's Black Zip-Up Hoodie with Paris Print,"This men's black zip-up hoodie features a minimalist graphic print on the chest with the word ""PARIS"" subtly integrated into a red and blue horizontal line design. It has a full-zip front, a drawstring hood, and a large front pocket. Style Vibe: Casual / Urban. Fit: Regular fit hoodie. Material: Fleece or cotton blend. Care: Machine wash cold. Matches Well With: Bottoms: Jeans, sweatpants, or joggers. Shoes: Sneakers. Accessories: A baseball cap.",$55.00,Image70.jpg
Men's White Stand-Collar Linen Shirt,"This men's white long-sleeve shirt features a stand collar and a partial button placket, offering a sophisticated yet relaxed look. The fabric appears to be linen, suggesting breathability and comfort. Style Vibe: Casual Chic / Resort Wear / Bohemian. Fit: Regular fit long-sleeve shirt. Material: Linen or linen blend. Care: Machine wash cold, gentle cycle. Matches Well With: Bottoms: Dark trousers (as shown), chinos, or linen shorts. Shoes: Loafers or espadrilles. Accessories: Sunglasses, a simple chain necklace.",$42.00,Image71.jpg
Men's Blue Corduroy Button-Up Shirt Jacket with Hood,"This men's blue long-sleeve shirt jacket is made of corduroy and features a contrasting light-colored hood, creating a layered look. It has a full button-down front and a single chest pocket with the same light-colored fabric as the hood. It's styled open over a white t-shirt. Style Vibe: Casual / Streetwear / Workwear-inspired. Fit: Relaxed fit shirt jacket. Material: Corduroy body with a cotton blend hood. Care: Machine wash cold. Matches Well With: Inner Tops: A plain white t-shirt (as shown). Bottoms: Jeans or cargo pants. Shoes: Sneakers or boots. Accessories: A beanie.",$60.00,Image72.jpg
Men's Black Track Jacket with White Stripes,"This men's black track jacket features a full zip-up front, a stand collar, and distinctive white V-shaped stripes across the chest and back. It has elasticated cuffs and hem. Style Vibe: Sporty / Retro / Casual. Fit: Relaxed fit track jacket. Material: Polyester or a performance blend. Care: Machine wash cold. Matches Well With: Bottoms: Track pants, joggers, or jeans. Shoes: Sneakers. Accessories: A baseball cap or sports watch.",$58.00,Image73.png
Men's Beige Short-Sleeve Linen Blend Shirt with Necklace,"This men's short-sleeve shirt is a light beige or natural color, made from a textured linen blend fabric, and features a stand collar with a partial button placket. It is styled with a long, dark brown string necklace that has a decorative pendant. A single buttoned pocket is on the left chest. Style Vibe: Casual / Bohemian / Resort Wear. Fit: Regular fit short-sleeve shirt. Material: Linen blend. Care: Machine wash cold. Matches Well With: Bottoms: Light-colored shorts or chinos. Shoes: Sandals or espadrilles. Accessories: Woven bracelets.",$38.00,Image74.jpg
Men's Black Cargo Pants with Large Pockets,"These men's black cargo pants are designed with a relaxed, baggy fit and feature large, prominent side pockets, giving them a utilitarian and streetwear aesthetic. They have elasticated cuffs and appear to be paired with chunky sneakers. Style Vibe: Streetwear / Casual / Urban. Fit: Loose fit, cargo pants. Material: Cotton or a durable blend. Care: Machine wash cold. Matches Well With: Tops: Oversized t-shirts, hoodies, or casual jackets. Shoes: Sneakers or combat boots. Accessories: A backpack, a chain.",$50.00,Image75.jpg
Men's Navy Half-Zip Pullover Sweatshirt,"This men's navy blue pullover sweatshirt features a half-zip closure at the neck and a large kangaroo pocket at the front. It's styled over a white t-shirt, with the white hem visible for a layered look. Style Vibe: Casual / Athleisure. Fit: Relaxed fit pullover sweatshirt. Material: Fleece or cotton blend. Care: Machine wash cold. Matches Well With: Bottoms: Joggers, jeans, or chinos. Shoes: Sneakers. Accessories: A simple watch.",$40.00,Image76.jpg
Men's Black Baggy Drawstring Trousers,"These men's black trousers feature a very loose, baggy fit with elasticated cuffs and a drawstring waist, giving them a relaxed and comfortable silhouette. They are styled with a plain black t-shirt and high-top sneakers, fitting a casual or streetwear aesthetic. Style Vibe: Streetwear / Casual / Urban. Fit: Loose fit, tapered at the ankle. Material: Lightweight fabric, possibly a cotton or synthetic blend. Care: Machine wash cold. Matches Well With: Tops: Oversized t-shirts, hoodies, or casual jackets. Shoes: Sneakers or casual boots. Accessories: A simple necklace.",$45.00,Image77.jpg
Men's White Ribbed Tank Top with Gold Pendant Necklace,"This men's white tank top features a ribbed texture and a classic U-neck design, offering a snug yet comfortable fit that highlights the physique. It is accessorized with a black string necklace featuring a round gold pendant. Style Vibe: Casual / Underwear as Outerwear / Layering Piece. Fit: Body-fit, ribbed tank top. Material: Cotton or cotton blend. Care: Machine wash cold. Matches Well With: Outerwear: Open shirts, hoodies, or jackets. Bottoms: Jeans, shorts, or casual trousers. Accessories: Chains or layered necklaces.",$15.00,Image78.jpg
Men's Grey Lightweight Hooded Windbreaker,"This men's grey hooded windbreaker features a full zip-up front, a drawstring hood with subtle text detailing, and two side pockets. The material appears lightweight and crinkled, suggesting it's suitable for light weather protection. Style Vibe: Casual / Sporty / Streetwear. Fit: Relaxed fit hooded jacket. Material: Lightweight synthetic fabric, like nylon or polyester. Care: Machine wash cold. Matches Well With: Bottoms: Joggers, jeans, or casual trousers. Shoes: Sneakers. Accessories: A baseball cap.",$55.00,Image79.jpg
Men's Black 2-in-1 Running Shorts,"These men's black shorts feature a 2-in-1 design with an outer loose-fitting short layer and an inner compression short layer, making them ideal for fitness activities. They have an elastic waistband with a drawstring. Style Vibe: Athletic / Gym / Running. Fit: Regular fit outer short with a compression inner short. Material: Polyester blend, moisture-wicking. Care: Machine wash cold. Matches Well With: Tops: Athletic t-shirts or tank tops. Shoes: Running shoes or training sneakers. Accessories: Sports watch, sweatband.",$30.00,Image80.jpg
Men's Beige and White Color Block Windbreaker Jacket,"This men's hooded windbreaker jacket features a beige main body with prominent white V-shaped color blocks across the chest and upper back. It has a full zip-up front and a small zippered pocket detail on the white stripe. Style Vibe: Sporty / Casual / Outdoor. Fit: Relaxed fit hooded jacket. Material: Lightweight, possibly water-resistant synthetic fabric. Care: Machine wash cold. Matches Well With: Bottoms: Light-colored chinos, joggers, or jeans. Shoes: Sneakers. Accessories: Sunglasses.",$65.00,Image81.jpg
Men's Khaki Button-Down Shirt with Chest Pockets,"This men's long-sleeve shirt in a khaki or beige color features a classic collar, full button-down front, and two buttoned flap pockets on the chest. The sleeves are rolled up to the forearms, suggesting a casual and relaxed style. Style Vibe: Casual / Utility / Everyday. Fit: Regular fit button-down shirt. Material: Cotton twill or similar durable fabric. Care: Machine wash cold. Matches Well With: Bottoms: White or dark jeans, chinos, or cargo pants. Shoes: Boots, sneakers, or casual loafers. Accessories: A watch.",$40.00,Image82.jpg
Men's Brown and Black Varsity Jacket with 'B' Patch,"This men's varsity jacket features a brown body with black ribbed cuffs and hem, and a prominent black letter 'B' patch on the chest. It's styled open over a white t-shirt with loose-fitting dark grey trousers and a black beanie. Style Vibe: Streetwear / Hip-hop / Casual. Fit: Relaxed fit varsity jacket. Material: Wool blend or similar substantial fabric for the body, with ribbed knit trim. Care: Dry clean recommended. Matches Well With: Inner Tops: White t-shirt (as shown). Bottoms: Jeans, cargo pants, or casual trousers. Shoes: Sneakers. Accessories: Beanie, glasses, small clutch bag.",$85.00,Image83.jpg
Men's Blue Workwear-Inspired Jacket with Oversized Jeans,"This men's outfit features a vibrant blue workwear-inspired jacket with two large chest pockets, worn open over a light blue and white striped long-sleeve shirt. It's paired with very loose-fitting, dark blue jeans and a dark beanie. Style Vibe: Workwear / Streetwear / Casual. Fit: Relaxed fit jacket and oversized jeans. Material: Cotton or canvas for the jacket, denim for the jeans. Care: Machine wash cold. Matches Well With: Inner Tops: Casual button-down shirts or t-shirts. Shoes: Casual sneakers or work boots. Accessories: Beanie, crossbody bag.",$70.00,Image84.jpg
Men's Black Abstract Print Short-Sleeve Camp Collar Shirt,"This men's black short-sleeve shirt features a subtle white abstract or speckled print and a relaxed camp collar. It is styled tucked into black trousers with a black belt, giving it a modern and minimalist aesthetic. Style Vibe: Modern Casual / Minimalist / Resort Wear. Fit: Relaxed fit short-sleeve shirt. Material: Viscose or a similar lightweight, flowy fabric. Care: Machine wash cold. Matches Well With: Bottoms: Black tailored trousers (as shown) or dark wash jeans. Shoes: Loafers or sleek sneakers. Accessories: A simple belt.",$52.00,Image85.jpg
Beige Round Brim Bucket Hat,"This versatile beige bucket hat features a classic round brim that offers ample sun protection, making it a practical and stylish accessory for outdoor activities or casual everyday wear. The neutral beige color ensures it can easily complement a wide range of outfits, adding a laid-back and trendy touch. Style Vibe: Casual Streetwear / Outdoor Chic. Fit: Standard bucket hat fit, designed for comfortable wear. Material: Durable cotton canvas or a poly blend, providing sun protection. Care: Hand wash cold, air dry. Matches Well With: Attire: Casual outfits, beachwear, streetwear, or athletic wear. Colors: Earth tones, pastels, white, or black.",$25.00,Image86.jpg
Black Baseball Cap with White 'NY' Embroidery,"This classic black baseball cap features prominent white embroidery of the iconic 'NY' (New York) logo on the front, offering a timeless and sporty urban style. The adjustable strap at the back ensures a comfortable fit, making it a popular accessory for casual outfits and adding a touch of city-inspired cool. Style Vibe: Urban Casual / Sporty Classic. Fit: Adjustable, one-size-fits-most baseball cap. Material: Cotton twill or blend. Care: Spot clean with damp cloth. Matches Well With: Attire: Casual streetwear, athletic wear, or everyday outfits. Colors: Any casual ensemble, particularly complementing monochrome or bright colors.",$20.00,Image87.jpg
Black Knit Beanie with Folded Cuff,"This versatile black knit beanie features a classic design with a folded cuff, providing extra warmth and a timeless, cozy aesthetic. The ribbed knit texture adds subtle detail, making it a perfect accessory for colder weather or for adding a touch of casual cool to an urban outfit. Style Vibe: Urban Casual / Winter Essential. Fit: Snug but stretchy, one-size-fits-most. Material: Soft acrylic knit. Care: Hand wash cold, lay flat to dry. Matches Well With: Attire: Casual streetwear, winter coats, hoodies, or outdoor wear. Colors: Easily pairs with any color palette due to its neutral black.",$18.00,Image88.jpg
Olive Green Wide Brim Bucket Hat,"This olive green wide-brim bucket hat offers extensive sun protection and a distinct outdoor-inspired style, making it ideal for adventurers or for adding a rugged edge to a casual outfit. The durable fabric and military-inspired color enhance its utilitarian appeal, perfect for exploring or everyday wear. Style Vibe: Outdoor Adventure / Utility Chic. Fit: Standard bucket hat fit with a wide brim for increased sun coverage. Material: Durable cotton canvas or ripstop nylon. Care: Hand wash cold, air dry. Matches Well With: Attire: Outdoor gear, cargo pants, utility jackets, or casual summer outfits. Colors: Earth tones, black, white, or denim.",$28.00,Image89.jpg
Brown Newsboy Cap,"This stylish brown newsboy cap offers a classic, vintage-inspired look, perfect for adding a touch of sophisticated charm to any outfit. Its soft, rounded silhouette and subtle brim create a timeless aesthetic that complements both casual and semi-formal wear. Style Vibe: Vintage Chic / Smart Casual. Fit: Comfortable and slightly relaxed, designed to fit snugly on the head. Material: Suede-like fabric or corduroy. Care: Spot clean only. Matches Well With: Attire: Blazers, trench coats, sweaters, jeans, or dresses. Colors: Earth tones, creams, navy, or black.",$35.00,Image90.jpg
Men's Brown Loafer Shoes with Buckle Detail,"These men's brown loafer shoes feature a sleek design with a distinctive buckle detail, offering a blend of casual comfort and refined style. Ideal for various occasions, they provide a polished finish to both relaxed and smart casual ensembles. Style Vibe: Smart Casual / Modern Classic. Fit: Slip-on style for easy wear, comfortable fit. Material: Faux leather or synthetic material. Care: Wipe clean with a damp cloth. Matches Well With: Attire: Chinos, tailored shorts, jeans, or casual trousers. Colors: Navy, beige, grey, or dark green.",$65.00,Image91.jpg
Women's White H-Strap Flat Sandals,"These women's white flat sandals feature a distinctive 'H' strap design, offering a chic and minimalist look perfect for warm weather. Their open-toe style and comfortable sole make them ideal for casual outings and everyday wear. Style Vibe: Minimalist Chic / Summer Essential. Fit: True to size, comfortable flat sole. Material: Faux leather or synthetic material. Care: Wipe clean with a damp cloth. Matches Well With: Attire: Sundresses, shorts, skirts, or light trousers. Colors: Neutrals, pastels, or bright summer colors.",$40.00,Image92.jpg
Women's Tan Buckle Clog Mules,"These women's tan clog mules feature a simple yet stylish design with an adjustable buckle, offering comfortable slip-on wear. Their versatile color and relaxed fit make them a great option for casual everyday outfits, providing both comfort and a touch of bohemian flair. Style Vibe: Casual Comfort / Bohemian Chic. Fit: Slip-on style, roomy fit. Material: Suede-like upper with a cork-like footbed. Care: Spot clean only. Matches Well With: Attire: Jeans, casual dresses, skirts, or wide-leg pants. Colors: Earth tones, white, denim, or autumnal shades.",$55.00,Image93.jpg
Men's Black and White Low-Top Canvas Sneakers,"These men's black and white low-top canvas sneakers offer a classic and versatile look, perfect for everyday casual wear. The contrasting white stitching and laces add a sporty touch, while the durable canvas material ensures comfort and longevity. Style Vibe: Classic Casual / Urban Streetwear. Fit: Lace-up for adjustable fit, comfortable low-top design. Material: Canvas upper with rubber sole. Care: Hand wash with mild soap, air dry. Matches Well With: Attire: Jeans, shorts, joggers, or casual trousers. Colors: Easily pairs with any color palette.",$50.00,Image94.jpg
Women's Tan Suede Closed Toe Clogs with White Socks,"These women's tan suede closed-toe clogs, paired with white socks, offer a cozy and casual look. The adjustable buckle provides a secure fit, while the soft suede material ensures comfort for everyday wear. Style Vibe: Cozy Casual / Modern Bohemian. Fit: Slip-on style with a comfortable, roomy fit. Material: Suede upper with a cork or rubber sole. Care: Spot clean suede, machine wash socks. Matches Well With: Attire: Jeans, casual dresses, wide-leg pants, or comfortable loungewear. Colors: Earth tones, white, denim, or autumnal shades.",$60.00,Image95.jpg
Men's Grey and White Chunky Platform Sneakers,"These men's grey and white chunky platform sneakers feature a modern, athletic design with a thick sole, offering both style and comfort. Ideal for a trendy streetwear look, they provide excellent support and a distinctive silhouette. Style Vibe: Streetwear Fashion / Sporty Chic. Fit: Lace-up for adjustable fit, provides good support. Material: Mixed materials (mesh, synthetic leather) with a rubber sole. Care: Wipe clean with a damp cloth. Matches Well With: Attire: Joggers, oversized hoodies, cargo pants, or casual denim. Colors: Neutrals, black, white, or bright accents.",$75.00,Image96.jpg
Unisex Black Chunky Platform Sneakers,"These unisex black chunky platform sneakers offer a bold and contemporary look with their monochromatic design and thick, sculpted sole. Perfect for those seeking a statement piece, they combine comfort with a distinctive, edgy aesthetic. Style Vibe: Urban Edge / Athleisure Fashion. Fit: Lace-up for adjustable fit, provides good support. Material: Synthetic and mesh upper with a durable rubber sole. Care: Wipe clean with a damp cloth. Matches Well With: Attire: Joggers, black denim, oversized tops, or streetwear ensembles. Colors: Black, grey, white, or bold accent colors.",$80.00,Image97.jpg
Women's White Quilted Low-Top Sneakers with Pearl Ankle Bracelet,"These women's white quilted low-top sneakers feature a stylish texture and metallic gold accents on the heel and eyelets, offering a chic yet casual look. Paired with a pearl ankle bracelet, they add a touch of elegance to any relaxed outfit. Style Vibe: Feminine Casual / Sporty Chic. Fit: Lace-up for adjustable fit, comfortable low-top design. Material: Faux leather with rubber sole. Care: Wipe clean with a damp cloth. Matches Well With: Attire: Jeans, casual dresses, skirts, or shorts. Colors: Pastels, light wash denim, or other light colors.",$58.00,Image98.jpg
