name,description,price,imageUrl
Pink Lightweight Oversized Top,"This breezy pink top offers a relaxed and comfortable fit with its oversized silhouette and long, voluminous sleeves. The lightweight, slightly sheer fabric and subtle V-neckline create a soft and feminine aesthetic, ideal for warm weather layering or a laid-back look. Style Vibe: Casual Cozy / Soft Girl Aesthetic. Fit: Oversized, relaxed. Material: Lightweight, breathable knit (polyester or cotton blend). Care: Hand wash cold or machine wash delicate. Matches Well With: Bottoms: Distressed denim shorts (as shown), high-waisted jeans, or a casual mini skirt. Inner Tops: A simple camisole or bralette if desired due to sheerness. Shoes: White sneakers, flat sandals, or canvas shoes. Accessories: A woven tote bag or a simple baseball cap.",$45.00,Image25.png
Light Blue Casual T-shirt,"This versatile light blue t-shirt features a classic crew neck and a relaxed, comfortable fit. Its simple design and soft fabric make it an essential everyday staple, perfect for pairing with a variety of bottoms for a casual and effortless look. Style Vibe: Everyday Casual / Minimalist Comfort. Fit: Regular, slightly relaxed. Material: Soft cotton jersey. Care: Machine wash cold. Matches Well With: Bottoms: Navy cargo pants (as shown), black jeans, or casual chino shorts. Outerwear: A lightweight jacket or an unbuttoned plaid shirt. Shoes: White sneakers, casual boots, or loafers. Accessories: A dark baseball cap or a casual canvas tote bag.",$30.00,Image26.png
White Sheer Overlay Jacket,"This unique white jacket features a sheer, lightweight overlay with distinct layered panels and pockets, creating a deconstructed yet stylish aesthetic. The underlying structure is a simple white top, allowing the sheer layer to add texture and a modern, airy feel. It's an ideal piece for stylish layering in warmer climates. Style Vibe: Contemporary Layering / Urban Chic. Fit: Relaxed, oversized. Material: Sheer polyester overlay with a cotton blend base. Care: Hand wash cold, hang to dry. Matches Well With: Bottoms: White wide-leg trousers, light-wash denim, or tailored shorts. Inner Tops: A simple white ribbed tank top (as shown) or a fitted camisole. Shoes: Platform sandals, white sneakers, or low-heeled mules. Accessories: A mesh tote bag (as shown) or a minimalist shoulder bag.",$70.00,Image27.png
Olive Green High-Waisted Cargo Pants,"These olive green cargo pants combine a flattering high-waisted fit with edgy, utilitarian details. They feature multiple large pockets, a prominent chain detail, and adjustable straps, creating a bold and statement-making look. The tapered leg finishes in a comfortable elasticated cuff, perfect for pairing with chunky footwear. Style Vibe: Grunge / Techwear. Fit: High-waisted, relaxed through the hip and thigh, tapered at the ankle. Material: Durable cotton-nylon blend. Care: Machine wash cold. Matches Well With: Tops: A cropped long-sleeve black top (as shown), a fitted tank top, or an oversized graphic hoodie. Outerwear: A leather biker jacket or a dark bomber jacket. Shoes: Combat boots (as shown), platform sneakers, or chunky lace-up boots. Accessories: A studded belt with chain details or a small, dark-colored backpack.",$79.00,Image28.png
Mustard Yellow Swing Mini Dress,"This cheerful mustard yellow mini dress features a simple crew neck and short sleeves, with a comfortable and flattering swing silhouette that flares gently from the bodice. Its vibrant color and effortless design make it a perfect casual piece for bright, sunny days, offering comfort without compromising on style. Style Vibe: Casual & Bright / Playful Everyday. Fit: Relaxed, A-line swing fit. Material: Soft, stretchy jersey knit (cotton blend). Care: Machine wash cold. Matches Well With: Outerwear: A light denim jacket or a white casual cardigan. Shoes: White sneakers, flat sandals, or espadrille wedges. Accessories: A canvas tote bag with a fun print or a wide-brimmed straw hat.",$45.00,Image29.png
Men's Navy Blue Pleated Trousers,"These sophisticated navy blue trousers feature subtle front pleats and a refined straight-leg cut, offering a polished yet comfortable silhouette. The dark, versatile color makes them suitable for both formal and smart-casual occasions, providing a sharp and classic addition to any menswear wardrobe. Style Vibe: Classic Formal / Smart Casual. Fit: Regular fit, straight-leg with a slight taper. Material: Smooth wool blend or polyester blend. Care: Dry clean recommended or machine wash cold on delicate. Matches Well With: Tops: A crisp white dress shirt, a light blue checkered button-down (as shown), or a fine-gauge knit sweater. Outerwear: A tailored blazer, a trench coat, or a smart casual jacket. Shoes: Leather dress shoes (oxfords or derbies), polished loafers, or minimalist leather sneakers. Accessories: A classic leather belt or a structured briefcase.",$70.00,Image30.png
Olive Green Tie-Waist Cargo Pants,"These stylish olive green cargo pants feature a high-waisted design with multiple functional flap pockets and a unique integrated self-tie belt, allowing for a cinched waist and a customized fit. The relaxed, straight-leg cut offers both comfort and a modern utility-inspired aesthetic, making them a versatile piece for casual and streetwear looks. Style Vibe: Urban Utility / Safari Chic. Fit: High-waisted, relaxed straight-leg, with an adjustable tie-waist. Material: Durable cotton twill. Care: Machine wash cold. Matches Well With: Tops: A black cropped top (as shown), a simple white tank, or a fitted long-sleeve tee. Outerwear: A denim jacket or a lightweight bomber jacket. Shoes: Chunky sneakers, combat boots, or casual flat sandals. Accessories: A black baseball cap or a canvas tote bag.",$75.00,Image31.png
White Tiered Lace Midi Skirt,"This ethereal white midi skirt features multiple tiers of lightweight fabric, with delicate lace trim peeking out from beneath each layer, adding a touch of romantic detail. The elasticated high waist ensures comfort and a flattering fit, while the flowy silhouette creates a whimsical and elegant look. Style Vibe: Boho Romantic / Gothic Lolita. Fit: High-waisted, relaxed A-line, tiered. Material: Lightweight cotton blend with lace trim. Care: Hand wash cold or gentle machine wash. Matches Well With: Tops: A black long-sleeve crop top (as shown), a delicate camisole, or an oversized knit sweater for contrast. Outerwear: A short, fitted leather jacket or a cropped denim jacket. Shoes: Chunky platform boots (as shown), delicate ballet flats, or simple canvas sneakers. Accessories: A wide-brimmed hat or a bohemian-style shoulder bag.",$68.00,Image32.png
Navy V-Neck Tiered Maxi Dress,"This classic navy maxi dress features a flattering V-neckline and a relaxed, tiered silhouette that drapes gracefully to a midi length. The sleeveless design and airy fabric make it ideal for warmer weather, offering both comfort and understated elegance for various casual and semi-formal occasions. Style Vibe: Resort Chic / Effortless Summer. Fit: Relaxed, flowing tiered maxi dress with a flattering V-neck. Material: Lightweight, breathable cotton or linen blend. Care: Machine wash cold, gentle cycle. Matches Well With: Outerwear: A light white denim jacket or a short, open-knit cardigan. Shoes: Flat sandals (as shown), espadrille wedges, or low block heels. Accessories: A wide-brimmed straw hat or a large canvas tote bag.",$85.00,Image33.png
Yellow A-Line Mini Skater Skirt,"This vibrant yellow mini skirt features a classic A-line skater silhouette, with a comfortable high-waisted fit that flares out playfully. The solid, bright color makes it a cheerful and energetic piece, perfect for adding a pop of color to a casual or youthful outfit. Style Vibe: Playful Pop / Preppy Casual. Fit: High-waisted, A-line skater skirt. Material: Textured polyester blend with some stretch. Care: Machine wash cold. Matches Well With: Tops: A white cropped tank top (as shown), a fitted graphic tee, or a simple black long-sleeve top. Outerwear: A cropped denim jacket or a light bomber jacket. Shoes: White sneakers, chunky platform shoes, or ankle boots. Accessories: A mini shoulder bag (as shown) or a bright baseball cap.",$35.00,Image34.png
Yellow Sheer Wide-Leg Beach Pants,"These bright yellow wide-leg pants are designed with a sheer, lightweight fabric, making them an ideal cover-up or statement piece for warm weather. They feature a comfortable drawstring waist and a relaxed, flowing silhouette that offers an airy and effortlessly chic look by the water or in sunny destinations. Style Vibe: Vacation Glam / Resort Wear. Fit: Relaxed, wide-leg, sheer, with an adjustable drawstring waist. Material: Lightweight, sheer polyester or chiffon. Care: Hand wash cold, hang to dry. Matches Well With: Tops: A white or black swimsuit top (as shown), a simple bandeau, or a flowy crop top. Outerwear: A sheer kimono or a light linen shirt. Shoes: Flat sandals, espadrilles, or wedges. Accessories: A large straw beach bag or a wide-brimmed sun hat.",$48.00,Image35.png
Navy Utility Midi Skirt with Belt,"This versatile navy midi skirt combines a comfortable elasticated waist with practical utility details, including multiple pockets and an integrated webbed belt with a buckle closure. The A-line silhouette offers a relaxed fit that’s both functional and stylish, perfect for an active casual look. Style Vibe: Gorpcore / Casual Utility. Fit: Relaxed A-line, midi length, with an elasticated waist and adjustable belt. Material: Durable cotton blend. Care: Machine wash cold. Matches Well With: Tops: A simple t-shirt, a fitted long-sleeve top, or a casual hoodie. Outerwear: A lightweight windbreaker or a utility vest. Shoes: Hiking boots, chunky sneakers, or sturdy sandals. Accessories: A practical cross-body bag or a beanie.",$62.00,Image36.png
Burgundy Pleated Wide-Leg Trousers,"These sophisticated burgundy trousers feature a high-waisted design with elegant front pleats that create a refined and flowing wide-leg silhouette. They come with a slim matching belt that cinches the waist, adding a polished touch. The rich, deep color makes them a versatile and chic option for both work and elevated casual wear. Style Vibe: Elegant Professional / Modern Classic. Fit: High-waisted, wide-leg, with pleats, and a belt. Material: Smooth, medium-weight polyester blend. Care: Machine wash cold, gentle cycle. Matches Well With: Tops: A tucked-in blouse in a neutral or contrasting color, a fitted knit top, or a tailored button-down shirt. Outerwear: A classic blazer or a long, structured coat. Shoes: Pointed-toe heels, platform loafers, or sleek ankle boots. Accessories: A structured top-handle bag or a slim clutch.",$89.00,Image37.png
Men's Navy Bomber Jacket,"This classic men's navy bomber jacket features a sleek, slightly oversized silhouette with a distinctive brown inner lining that peeks out. It includes a smart collar, full zip closure, and functional flap pockets on the front. The ribbed cuffs and hem add to its iconic style, making it a timeless and versatile layering piece for a cool, casual look. Style Vibe: Urban Casual / Modern Classic. Fit: Slightly oversized bomber fit. Material: Smooth, durable polyester outer with a contrasting inner lining. Care: Dry clean recommended. Matches Well With: Bottoms: Khaki cargo pants (as shown), dark wash jeans, or tailored chinos. Inner Tops: A simple white t-shirt (as shown) or a thin knit sweater. Shoes: White sneakers, combat boots, or casual leather shoes. Accessories: A casual messenger bag or a structured backpack.",$110.00,Image38.png
Blue Tropical Print Sarong Skirt,"This vibrant sarong skirt features a beautiful blue tropical print with leafy motifs and intricate borders, evoking a relaxed, beachy vibe. Its wrap-around style allows for an adjustable fit and a flowing, asymmetrical hemline, making it an effortlessly chic cover-up or a statement piece for warm weather. Style Vibe: Bohemian Beach / Tropical Getaway. Fit: Adjustable wrap-around, flowing, asymmetrical. Material: Lightweight, breathable fabric (e.g., rayon or cotton voile). Care: Hand wash cold, hang to dry. Matches Well With: Tops: A simple white bikini top (as shown), a solid-colored bandeau, or a lightweight camisole. Shoes: Flat sandals or espadrille wedges. Accessories: A large straw beach bag or a wide-brimmed sun hat.",$45.00,Image39.png
Yellow Floral Spaghetti Strap Midi Dress,"This enchanting yellow midi dress features delicate spaghetti straps and a flattering sweetheart neckline with a charming ruched or tie-front detail at the bust. Adorned with a vibrant floral print in shades of pink, purple, and orange, the dress has a flowing silhouette that gracefully falls to a midi length with an asymmetrical hem. Style Vibe: Romantic Summer / Whimsical Chic. Fit: Fitted bust with a flowing A-line midi skirt. Material: Lightweight, airy fabric (likely chiffon or georgette) with a subtle sheen. Care: Dry clean recommended or delicate hand wash. Matches Well With: Outerwear: A light white cardigan or a cropped denim jacket. Shoes: Strappy heeled sandals, elegant mules, or dressy flat sandals. Accessories: A delicate clutch bag or a floral-embellished hair clip.",$98.00,Image40.jpg
Black Wide-Leg Lounge Pants,"These comfortable black wide-leg lounge pants feature a high-waisted design with a broad elasticated waistband for a secure yet relaxed fit. Their flowing silhouette offers ample movement and an effortlessly chic, minimalist aesthetic, making them ideal for casual wear, light exercise, or lounging. Style Vibe: Athleisure Comfort / Minimalist Everyday. Fit: High-waisted, wide-leg, relaxed. Material: Soft, stretchy knit fabric (e.g., jersey or a cotton blend). Care: Machine wash cold. Matches Well With: Tops: A black cropped long-sleeve top (as shown), a fitted tank top, or an oversized t-shirt. Shoes: Flat sandals (as shown), minimalist sneakers, or slip-on mules. Accessories: A simple tote bag or delicate silver jewelry.",$55.00,Image41.png
Men's Charcoal Grey Work Jacket,"This versatile men's charcoal grey work jacket offers a clean and structured design, featuring a classic collar and a full zip closure. Its minimalist aesthetic and neutral color make it a practical and stylish layering piece for various casual and smart-casual outfits, providing both comfort and a refined edge. Style Vibe: Urban Casual / Modern Workwear. Fit: Regular fit, structured but comfortable for layering. Material: Durable cotton or poly-blend twill. Care: Machine wash cold. Matches Well With: Bottoms: Olive green trousers (as shown), dark wash jeans, or black chinos. Inner Tops: A light grey crew-neck sweatshirt (as shown) or a simple white t-shirt. Shoes: Sneakers or casual boots. Accessories: A classic watch or a canvas backpack.",$90.00,Image42.png
Men's Black 'Milano 96' Graphic Tank Top,"This bold black men's tank top features a striking white 'MILANO 96' graphic print on the chest, giving it a distinct streetwear or vintage athletic vibe. Its sleeveless design and relaxed fit make it perfect for casual wear, especially in warmer weather, or for making a statement. Style Vibe: Streetwear / Retro Sporty. Fit: Relaxed fit, sleeveless. Material: Soft cotton jersey. Care: Machine wash cold, inside out. Matches Well With: Bottoms: White relaxed-fit trousers (as shown), cargo shorts, or distressed jeans. Shoes: Chunky sneakers or high-top canvas shoes. Accessories: A silver chain necklace or a baseball cap.",$32.00,Image43.jpg
Men's Black Drawstring Cargo Shorts,"These practical and stylish men's black cargo shorts feature a comfortable elasticated drawstring waist and a relaxed, knee-length fit. Multiple side pockets add a utilitarian touch and functionality, making them perfect for casual everyday wear or outdoor activities. Style Vibe: Urban Casual / Street Utility. Fit: Relaxed fit, knee-length, with adjustable drawstring waist. Material: Durable cotton blend. Care: Machine wash cold. Matches Well With: Tops: An oversized black t-shirt (as shown), a graphic tee, or a simple white tank top. Shoes: Chunky sneakers (as shown), high-top trainers, or slide sandals. Accessories: A baseball cap or a cross-body bag.",$45.00,Image44.jpg
Men's Grey Open-Front Cardigan,"This lightweight men's grey open-front cardigan offers a minimalist and versatile layering option. Its simple design with a clean, collarless front and long sleeves makes it an excellent choice for adding a touch of casual sophistication to an outfit without being too heavy, suitable for various seasons. Style Vibe: Modern Casual / Minimalist Layering. Fit: Relaxed, open-front, long-sleeve. Material: Lightweight knit (e.g., cotton or rayon blend). Care: Machine wash cold, gentle cycle. Matches Well With: Tops: A simple white crew-neck t-shirt (as shown) or a light-colored button-down shirt. Bottoms: Black trousers (as shown), dark wash jeans, or tailored chinos. Shoes: White sneakers, loafers, or casual boots. Accessories: A simple watch or a leather bracelet.",$58.00,Image45.jpg
Men's Black 'OX X' Graphic T-Shirt,"This oversized black men's t-shirt features a striking and edgy white graphic print on the back, incorporating abstract shapes and text that gives it a distinct streetwear or rebellious aesthetic. The relaxed, boxy fit and short sleeves make it a comfortable and bold statement piece for casual wear. Style Vibe: Streetwear / Edgy Casual. Fit: Oversized, relaxed, short-sleeve. Material: Soft cotton jersey. Care: Machine wash cold, inside out. Matches Well With: Bottoms: Distressed jeans, cargo pants, or black shorts. Shoes: Chunky sneakers, combat boots, or skate shoes. Accessories: A baseball cap (as shown) or a minimalist watch.",$38.00,Image46.jpg
Men's Grey Textured Short-Sleeve Shirt,"This stylish men's grey short-sleeve shirt features a unique textured fabric, possibly a subtle geometric pattern or a raised weave, adding depth and interest to its simple design. It has a classic collar and full button placket, with sleeves that can be casually rolled up. It is shown open over a white t-shirt. Style Vibe: Smart Casual / Summer Modern. Fit: Regular fit, can be worn open or buttoned. Material: Textured cotton or linen blend. Care: Machine wash cold. Matches Well With: Bottoms: Dark wash jeans, light-colored chinos, or black shorts. Inner Tops: A simple white t-shirt (as shown) or a plain tank top. Shoes: White sneakers, loafers, or espadrilles. Accessories: A long pendant necklace (as shown) or a casual watch.",$48.00,Image47.jpg
Men's Faded Black/Grey Gradient Tank Top,"This men's tank top features a unique faded black to grey gradient effect, giving it a distinctive worn-in look. A small, vibrant graphic emblem on the chest adds a pop of color and personality. Its classic scoop neck and sleeveless design make it a casual and comfortable choice for warm weather. Style Vibe: Casual Summer / Retro Sporty. Fit: Regular fit, scoop neck, sleeveless. Material: Soft cotton blend. Care: Machine wash cold. Matches Well With: Bottoms: White shorts (as shown), light wash jeans, or black cargo shorts. Shoes: Canvas sneakers, slide sandals, or boat shoes. Accessories: A simple bracelet (as shown) or sunglasses.",$29.00,Image48.jpg
Men's Grey Long-Sleeve Button-Down Shirt,"This classic men's long-sleeve button-down shirt comes in a versatile grey shade, offering a clean and polished look. It features a traditional collar, full button placket, and a single chest pocket. The sleeves can be rolled up for a more casual style, making it suitable for both smart-casual and relaxed everyday wear. Style Vibe: Smart Casual / Everyday Essential. Fit: Regular fit, long-sleeve button-down. Material: Soft cotton or flannel blend. Care: Machine wash cold. Matches Well With: Bottoms: Black trousers (as shown), dark wash jeans, or navy chinos. Inner Tops: A simple white crew-neck t-shirt. Shoes: White sneakers, casual boots, or loafers. Accessories: A leather bracelet (as shown) or a classic watch.",$55.00,Image49.jpg
Men's Grey Slim-Fit Track Pants,"These athletic men's track pants feature a modern slim, tapered fit with elasticated cuffs, providing a streamlined and comfortable silhouette. They are designed with functional zip pockets, and a drawstring waist, making them ideal for workouts or casual athleisure wear. The subtle branding adds a sporty touch. Style Vibe: Athleisure / Sporty Casual. Fit: Slim, tapered, elasticated cuffs, drawstring waist. Material: Stretchy polyester blend. Care: Machine wash cold. Matches Well With: Tops: A t-shirt or a performance-oriented athletic top. Outerwear: A hoodie or a lightweight track jacket. Shoes: White athletic sneakers (as shown) or running shoes. Accessories: A sports watch or a water bottle.",$65.00,Image50.jpg
Men's Washed Grey Loose Fit Straight Leg Jeans,"These men's washed grey jeans offer a relaxed and trendy loose fit with a straight leg silhouette, perfect for a comfortable yet stylish casual look. The washed grey finish gives them a vintage, worn-in appeal, suitable for various streetwear and casual outfits. Style Vibe: Streetwear / Vintage Casual. Fit: Loose fit, straight leg. Material: Denim (cotton). Care: Machine wash cold. Matches Well With: Tops: An oversized black long-sleeve t-shirt (as shown) or a graphic hoodie. Shoes: Canvas sneakers (as shown) or chunky trainers. Accessories: A baseball cap or a crossbody bag.",$68.00,Image51.jpg
Men's Blue Cat Graphic Crewneck Sweatshirt,"This light blue men's crewneck sweatshirt features an adorable graphic print of a cat wearing a backpack, with Japanese text on the side. It offers a relaxed fit and a cozy feel, making it a comfortable and quirky choice for casual wear. Style Vibe: Kawaii Casual / Harajuku Streetwear. Fit: Relaxed fit crewneck. Material: Soft cotton blend fleece. Care: Machine wash cold. Matches Well With: Bottoms: Dark wash jeans or casual cargo pants. Shoes: White sneakers or canvas shoes. Accessories: A simple silver necklace (as shown) or a beanie.",$42.00,Image52.jpg
Men's Rust Brown Overshirt with Pockets,"This men's rust brown overshirt features a classic collar and full button-front closure, with multiple large flap pockets on the chest and lower body, giving it a utilitarian workwear aesthetic. Its relaxed fit makes it an ideal layering piece over t-shirts, perfect for a rugged yet stylish casual look. Style Vibe: Workwear Inspired / Urban Casual. Fit: Relaxed fit overshirt. Material: Durable cotton twill. Care: Machine wash cold. Matches Well With: Inner Tops: A plain white t-shirt (as shown) or a thin long-sleeve top. Bottoms: Black jeans (as shown) or dark-colored chinos. Shoes: Boots or casual sneakers. Accessories: A canvas backpack (as shown) or a simple necklace.",$70.00,Image53.jpg
Men's Navy Pinstripe Short-Sleeve Henley Shirt,"This men's navy blue short-sleeve Henley shirt features classic white pinstripes and a band collar with a partial button placket. The relaxed fit and rolled-up sleeves offer a casual and comfortable aesthetic, making it suitable for warm weather and relaxed outings. Style Vibe: Casual Summer / Resort Wear. Fit: Relaxed fit, short-sleeve, band collar. Material: Lightweight cotton or linen blend. Care: Machine wash cold. Matches Well With: Bottoms: Light-colored chinos, linen shorts, or dark wash jeans. Shoes: Espadrilles, boat shoes, or casual sneakers. Accessories: Sunglasses or a woven bracelet.",$40.00,Image54.jpg
Men's Black Loose Fit Cropped Cargo Pants,"These black men's cropped cargo pants offer a contemporary, loose fit that falls above the ankle, providing a modern streetwear aesthetic. They feature large side cargo pockets and an elasticated drawstring waist for comfort and adjustability, blending utility with casual style. Style Vibe: Streetwear / Urban Utility. Fit: Loose fit, cropped, elasticated waist. Material: Cotton twill or nylon blend. Care: Machine wash cold. Matches Well With: Tops: A loose-fitting t-shirt (as shown) or a cropped hoodie. Shoes: High-top sneakers (as shown) or chunky trainers. Accessories: A bucket hat or a cross-body bag.",$60.00,Image55.jpg
Men's Blue and White Striped Oversized Shirt,"This men's shirt features classic blue and white vertical stripes and an oversized, relaxed fit, offering a comfortable and effortlessly stylish look. It has a traditional collar and full button-down front, with sleeves designed to be casually rolled up. Style Vibe: Laid-back Chic / Preppy Casual. Fit: Oversized, long-sleeve, button-down. Material: Lightweight cotton or linen blend. Care: Machine wash cold. Matches Well With: Bottoms: Black trousers (as shown) or light wash jeans. Shoes: White sneakers or loafers. Accessories: Sunglasses or a simple watch.",$52.00,Image56.jpg
Men's Black V-Neck Button-Up Cardigan,"This men's black cardigan features a clean V-neckline and a simple button-up front, offering a minimalist and versatile layering piece. Its lightweight knit makes it suitable for adding a touch of sophistication to casual outfits across various seasons. Style Vibe: Minimalist Casual / Smart Layering. Fit: Regular fit, V-neck, button-up. Material: Lightweight knit (e.g., cotton blend). Care: Machine wash cold, gentle cycle. Matches Well With: Inner Tops: A white crew-neck t-shirt (as shown) or a thin turtleneck. Bottoms: Light grey trousers (as shown) or dark jeans. Shoes: Loafers or minimalist sneakers. Accessories: A simple watch.",$65.00,Image57.jpg
