name,description,price,imageUrl
Zara Sequin Maxi Skirt,"This captivating black sequin maxi skirt is designed to shimmer and reflect light with every step, creating a dynamic and luxurious visual effect. The skirt falls gracefully, featuring a fluid A-line silhouette that offers both comfort and sophisticated movement. The intricate sequin embellishments cover the entire fabric, ensuring a dazzling presence whether under subtle or bright lights. Style Vibe: Glamorous Chic / Evening Elegance. Fit: Flowy, A-line, designed to skim the body without clinging, providing an ethereal and elegant drape. Material: Lightweight fabric densely adorned with black sequins, offering a tactile and visually rich texture. Care: Due to the delicate nature of sequins, dry clean recommended to maintain its integrity and sparkle. Matches Well With: Tops: A clean, crisp white oversized t-shirt for a modern high-low contrast, a sleek black silk camisole for classic elegance, or a finely ribbed black long-sleeve top for cooler evenings. Outerwear: A structured leather biker jacket to introduce an edgy, contrasting element, or a classic, sharply tailored black blazer for a more polished and formal occasion. Shoes: Chic black ankle boots with a modest heel for an elevated casual look, or sophisticated stiletto heels to enhance its formal appeal. Accessories: A minimalist black clutch bag or a metallic silver chain-strap shoulder bag to complement the skirt's sparkle.",$129.90,Image1.jpg
Korean V-Neck Blouse,"This charming light pink blouse features a gentle V-neckline adorned with subtle, color-matched buttons running down the front, creating a soft focal point. Its short sleeves are delicately puffed, adding a touch of feminine volume without being overwhelming. The fabric drapes beautifully, offering a relaxed yet refined fit that is both comfortable and stylish for various occasions. Style Vibe: Feminine Casual / Soft Girl Aesthetic. Fit: Relaxed and comfortable, designed to gently fall over the body. The puffed sleeves add a subtle, flattering volume. Material: Lightweight, soft polyester blend that feels smooth against the skin and holds its shape well. Care: Machine wash cold on a gentle cycle to preserve the fabric and details. Matches Well With: Bottoms: High-waisted A-line skirts in pastel tones, tailored capri pants for a sophisticated daytime look, or light-wash straight-leg jeans for a casual outing. Outerwear: A light, unbuttoned cream cardigan for added warmth and softness, or a classic cropped denim jacket for a more casual and youthful ensemble. Shoes: Classic ballet flats for a sweet, simple look, white canvas sneakers for comfortable everyday wear, or low block heels for a touch of refined elegance. Accessories: A small, structured pastel-colored handbag or a cute straw tote bag for a summery feel.",$49.90,Image2.png
Pink Corduroy Jacket,"This stylish pink corduroy jacket reinterprets the classic trucker jacket design with a delightful pastel hue and a striking contrast brown collar. It features large, gold-tone buttons that stand out, adding a vintage-inspired charm. The jacket is designed with a slightly oversized, boxy fit, making it an excellent layering piece that offers both comfort and a distinctly retro-cool aesthetic. Style Vibe: Soft Academia / Vintage Casual. Fit: Boxy and slightly oversized, allowing for comfortable layering over various tops without restricting movement. Material: Soft, textured corduroy (likely a cotton blend) that provides warmth and a distinctive tactile feel. Care: Machine wash cold on a delicate cycle to protect the corduroy texture and color. Matches Well With: Bottoms: Pleated midi skirts in neutral tones, tailored plaid trousers for an academic-inspired look, or light-wash distressed denim jeans for a laid-back, effortlessly cool outfit. Inner Tops: A simple white crew-neck t-shirt, a fitted ribbed knit top, or a classic collared shirt in a contrasting color. Shoes: Chunky loafers for a scholastic touch, sturdy combat boots for an edgy vibe, or retro high-top canvas sneakers for a casual, sporty feel. Accessories: A brown leather satchel bag or a vintage-inspired beret.",$89.90,Image3.png
Pink A-Line High-Waisted Midi Skirt,"This elegant pink midi skirt boasts a flattering high-waisted design that cinches the waist, flowing into a graceful A-line silhouette with gentle pleats. The skirt's structure allows it to maintain its beautiful drape while providing comfortable movement. It comes with a sleek black belt featuring a gold buckle, which perfectly complements the soft pink and adds a touch of sophisticated contrast. Style Vibe: Classic Feminine / Elegant Casual. Fit: High-waisted and A-line, designed to highlight the waist and flow outwards for a universally flattering shape. Material: Smooth, medium-weight polyester blend fabric that holds its pleats well and has a subtle sheen. Care: Machine wash cold, preferably on a gentle cycle, to maintain the fabric's integrity and pleating. Matches Well With: Tops: A fitted black or white knit top for a streamlined look, a tucked-in silk blouse in a complementary shade, or a delicate lace camisole for a more refined ensemble. Outerwear: A classic tailored blazer in black or navy, a form-fitting cardigan, or a sophisticated trench coat. Shoes: Elegant heeled sandals, pointed-toe flats, or graceful ankle boots with a slender heel. Accessories: A structured top-handle bag in a dark tone or a chic wide-brimmed hat for an outdoor event.",$79.90,Image4.png
Beige A-Line Wide-Leg Trousers,"These sophisticated beige trousers feature a high-waisted A-line cut with refined pleats that extend downwards, creating a flowing and spacious wide-leg silhouette. The design offers an unparalleled combination of comfort and tailored elegance, making them perfect for creating a polished yet relaxed look. The light, neutral color ensures versatility across a multitude of outfits and occasions. Style Vibe: Minimalist Chic / Effortless Elegance. Fit: High-waisted, wide-leg, and relaxed, designed to offer maximum comfort while maintaining a refined and elongated silhouette. Material: Lightweight linen or a breathable cotton blend, providing excellent drape and comfort, especially in warmer climates. Care: Machine wash cold on a gentle cycle to preserve the fabric's soft texture and prevent creasing. Matches Well With: Tops: A tucked-in simple white t-shirt, a fitted ribbed knit top in a complementary neutral color, or an oversized, unbuttoned linen shirt for a relaxed yet stylish ensemble. Outerwear: A light, unlined blazer in a matching neutral tone, a relaxed linen overshirt, or a long, flowing cardigan. Shoes: Elegant espadrille wedges, minimalist flat sandals, or pristine white low-top sneakers for a clean, contemporary look. Accessories: A large, structured straw tote bag for a summery vibe or a sophisticated leather crossbody bag.",$85.90,Image5.png
Olive Green Baggy Cargo Pants,"These olive green cargo pants embody a contemporary streetwear aesthetic with their distinctively baggy fit and utilitarian details. They feature prominent side cargo pockets, along with adjustable drawstring details at both the waist and the ankles, allowing for a customizable fit and silhouette. Their relaxed and loose design ensures ultimate comfort and an effortlessly cool, urban-inspired vibe. Style Vibe: Streetwear / Utility Chic. Fit: Extremely baggy and oversized throughout the leg, offering a relaxed and unrestrictive feel, with adjustable elements for personalized styling. Material: Durable cotton-poly blend, designed to withstand daily wear while maintaining a comfortable feel. Care: Machine wash cold for easy care and to preserve the fabric's integrity. Matches Well With: Tops: A tight-fitting cropped t-shirt to balance the baggy bottoms, an oversized graphic hoodie for a full streetwear ensemble, or a simple fitted tank top. Outerwear: A classic bomber jacket, a distressed denim jacket, or a lightweight windbreaker. Shoes: Chunky platform sneakers, sturdy combat boots, or classic high-top canvas sneakers for an authentic streetwear finish. Accessories: A black canvas tote bag or a casual baseball cap.",$69.90,Image6.png
Men's Burgundy Chinos,"These striking burgundy chinos offer a modern and sophisticated alternative to traditional casual trousers. They feature a refined slim, tapered fit that contours neatly without being restrictive, creating a sharp and contemporary silhouette. The rich, deep burgundy color adds a bold yet versatile touch, making them suitable for elevating both casual and smart-casual outfits. Style Vibe: Smart Casual / Contemporary Gentleman. Fit: Slim and tapered through the leg, designed to offer a sleek and modern outline without compromising comfort. Material: Soft yet durable cotton blend with a slight stretch, ensuring comfort and shape retention throughout the day. Care: Machine wash cold to maintain the color vibrancy and fabric quality. Matches Well With: Tops: A crisp white oxford shirt for a timeless smart-casual look, a light blue chambray shirt for a relaxed yet put-together vibe, or a simple charcoal grey crew-neck t-shirt for a casual outing. Outerwear: A light brown or navy casual button-down shirt (worn open over a tee), a classic denim jacket, or a lightweight bomber jacket. Shoes: Clean white minimalist sneakers for a fresh, modern pairing, classic brown leather loafers, or stylish desert boots. Accessories: A timeless leather belt in brown or black, or a sleek, minimalist watch.",$59.90,Image7.png
Men's Cream Track Jacket,"This understated cream track jacket presents a clean and minimalist design, featuring a classic stand-up collar and a full zip closure. Its simple lines and neutral cream color ensure versatility, making it an effortless layering piece for achieving a comfortable yet polished casual look. The design prioritizes comfort without sacrificing a refined aesthetic. Style Vibe: Casual Sporty / Minimalist Everyday. Fit: Regular fit, offering enough room for layering without appearing bulky, designed for comfortable, everyday wear. Material: Soft, medium-weight cotton-poly blend, providing warmth and a comfortable feel against the skin. Care: Machine wash cold for easy maintenance and longevity. Matches Well With: Bottoms: Dark brown corduroy trousers (as pictured), sleek black denim jeans, or tailored charcoal grey joggers for a relaxed but refined ensemble. Inner Tops: A simple white ribbed tank top for a layered look, or a plain crew-neck t-shirt in white or a muted tone. Shoes: Clean white minimalist sneakers for a cohesive look, black chunky loafers, or casual suede boots. Accessories: A black canvas tote bag for daily essentials or a simple, dark-colored baseball cap.",$75.90,Image8.png
Yellow Collared Blouse,"This vibrant yellow blouse brightens any ensemble with its cheerful hue and classic design. It features a crisp, pointed collar and a gentle V-neckline, complemented by sleeves that are styled with a rolled-up tab, adding a touch of casual sophistication. Its comfortable fit and eye-catching color make it a versatile piece suitable for both professional settings and relaxed outings. Style Vibe: Cheerful Chic / Smart Casual. Fit: Relaxed yet structured, designed to drape comfortably while maintaining a polished appearance. Material: Lightweight and breathable polyester fabric, ensuring comfort and easy care. Care: Machine wash cold on a gentle cycle to preserve its vibrant color and smooth texture. Matches Well With: Bottoms: Tailored beige high-waisted trousers for a professional yet stylish look, dark wash straight-leg jeans for a casual chic outfit, or a navy pencil skirt for a classic office ensemble. Outerwear: A tailored white blazer for a sophisticated contrast, or a light denim jacket for a more casual and approachable vibe. Shoes: Classic loafers, low block heels for comfort and elegance, or white minimalist sneakers for a fresh, casual pairing. Accessories: A structured, neutral-toned handbag or a large, chic straw hat for sunny days.",$54.90,Image9.png
Cream Varsity Jacket with Embellishments,"This cream varsity jacket offers a playful yet glamorous take on a classic athletic staple. It features a large, intricate design on the front, adorned with dazzling sequins or rhinestones, making it a true statement piece. The jacket maintains traditional varsity elements like striped ribbed cuffs and hem, while its oversized fit provides a comfortable and contemporary silhouette, perfect for creating a bold and youthful look. Style Vibe: Trendy Streetwear / K-Pop Inspired. Fit: Significantly oversized and relaxed, designed to be worn loosely for a modern and comfortable aesthetic. Material: Soft cotton-poly blend body with detailed sequin or rhinestone embellishments, and ribbed knit trim. Care: Due to embellishments, dry clean recommended or very gentle hand wash to protect the intricate details. Matches Well With: Bottoms: Distressed light-wash jeans, wide-leg cargo pants in a neutral color, or a pleated mini skirt for a more feminine edge. Inner Tops: A plain cropped top, an oversized graphic t-shirt that peeks from underneath, or a fitted long-sleeve top. Shoes: Chunky platform sneakers, sturdy combat boots, or classic high-top canvas shoes to complete the streetwear aesthetic. Accessories: A casual baseball cap in a complementary color or a trendy mini backpack.",$99.90,Image10.png
Pink Ribbed Polo Mini Dress,"This delightful pink polo mini dress features a ribbed knit texture that offers a flattering, body-hugging fit through the bodice and waist, flaring gently into a playful A-line skirt. The classic polo collar and button placket add a touch of sporty elegance, making it perfect for a cute yet comfortable everyday look. Style Vibe: Sweet Casual / Preppy Chic. Fit: Fitted at the bust and waist, with a subtle flare at the skirt. Stretchy ribbed material allows for comfort and movement. Material: Soft, stretchy ribbed knit (cotton blend). Care: Machine wash cold, gentle cycle. Matches Well With: Outerwear: A light denim jacket or a white cropped cardigan. Shoes: White sneakers, canvas trainers, or simple ballet flats. Accessories: A small cross-body bag in white or pastel shades, or a baseball cap for a sportier touch.",$55.00,Image11.png
Charcoal Grey Belted Shirt Dress,"This sophisticated charcoal grey shirt dress features a structured collar and full-length button placket, exuding a polished and modern aesthetic. Shoulder epaulets add a subtle utilitarian detail, while the matching adjustable belt cinches the waist to create a flattering silhouette. The long sleeves can be rolled up for a more relaxed look. Style Vibe: Office Chic / Modern Professional. Fit: Tailored, with a cinched waist that flares slightly into an A-line skirt. Material: Smooth, mid-weight polyester blend fabric. Care: Machine wash cold, hang to dry. Matches Well With: Outerwear: A structured blazer in black or a deep jewel tone, or a classic trench coat. Shoes: Pointed-toe ankle boots, sleek loafers, or elegant low block heels. Accessories: A structured leather tote bag or a minimalist clutch.",$78.00,Image12.png
Cream Halter Vest & Wide-Leg Trousers Set,"This coordinating cream set features a chic halter-neck vest with button-front detailing, paired with high-waisted, wide-leg trousers. The vest offers a flattering and bold silhouette, while the trousers provide a relaxed yet elegant drape, creating a modern and sophisticated look inspired by vintage aesthetics. Style Vibe: Boho Chic / Vintage Inspired. Fit: Vest is fitted and cropped; trousers are high-waisted and wide-leg. Material: Soft, textured corduroy or cotton blend. Care: Machine wash cold, delicate cycle. Matches Well With: Outerwear: A lightweight, open-front cardigan or a cropped denim jacket. Shoes: Platform sandals, espadrille wedges, or clean white sneakers. Accessories: A patterned shoulder bag (e.g., leopard print) or a bohemian-inspired floppy hat.",$110.00,Image13.png
Cropped Khaki Utility Jacket,"This versatile cropped khaki jacket blends military-inspired utility with a casual, modern cut. It features a broad collar, a full zip closure, and subtle shoulder epaulets, along with functional flap pockets. The cropped length makes it an ideal layering piece for high-waisted bottoms, offering a stylish and effortless silhouette. Style Vibe: Urban Utility / Casual Chic. Fit: Cropped, slightly oversized in the body. Material: Durable cotton twill. Care: Machine wash cold. Matches Well With: Bottoms: High-waisted jeans (as shown), cargo pants, or a mini skirt. Inner Tops: A simple white cropped t-shirt or a fitted tank top. Shoes: Combat boots, platform sneakers, or chunky loafers. Accessories: A canvas tote bag or a utilitarian-style cross-body bag.",$85.00,Image14.png
Black Ribbed Zip-Up Polo Top,"This sleek black top features a classic polo collar with a modern half-zip detail, allowing for adjustable neckline styling. Its ribbed knit construction ensures a flattering, form-fitting silhouette that accentuates the figure. The short sleeves and tailored fit make it a versatile piece for both casual and elevated everyday wear. Style Vibe: Minimalist Sporty / Casual Chic. Fit: Fitted and body-hugging due to ribbed material. Material: Soft, stretchy ribbed knit (cotton blend). Care: Machine wash cold, gentle cycle. Matches Well With: Bottoms: High-waisted jeans (as shown), tailored trousers, or a denim mini skirt. Outerwear: An oversized blazer for contrast, or a leather jacket. Shoes: White sneakers, chunky loafers, or ankle boots. Accessories: A minimalist shoulder bag or a small, sleek backpack.",$39.00,Image15.png
Bubblegum Pink Baggy Cargo Pants,"These eye-catching bubblegum pink cargo pants bring a playful and bold twist to the popular utilitarian trend. They feature multiple large cargo pockets and adjustable drawstring details at the waist and ankles, allowing for versatile styling. The extremely baggy fit ensures maximum comfort and a distinctive, fashion-forward silhouette. Style Vibe: Y2K Streetwear / Playful Utility. Fit: Extremely baggy and oversized throughout the leg, with adjustable cinching at waist and ankles. Material: Lightweight nylon or poly blend. Care: Machine wash cold, gentle cycle. Matches Well With: Tops: A cropped white tank top, an oversized graphic tee, or a fitted black long-sleeve top. Outerwear: A cropped hoodie or a short denim jacket. Shoes: Chunky platform sneakers, brightly colored trainers, or canvas high-tops. Accessories: A mini shoulder bag in a contrasting color or a bucket hat.",$72.00,Image16.png
Dusty Rose Pleated Midi Dress,"This elegant dusty rose midi dress features a classic collared neckline with a subtle button placket, and charming short sleeves. The fitted bodice cinches at the waist with a subtle belt detail, flowing into a beautifully pleated A-line skirt that creates a graceful silhouette. This dress combines timeless charm with modern sophistication. Style Vibe: Vintage Feminine / Classic Elegance. Fit: Fitted bodice with a cinched waist, flowing into a pleated A-line midi skirt. Material: Smooth, structured polyester blend fabric. Care: Dry clean recommended or hand wash cold. Matches Well With: Outerwear: A tailored trench coat or a delicate long cardigan. Shoes: Pointed-toe heels, classic ballet flats, or elegant block heels. Accessories: A structured top-handle bag in white or cream, or a delicate fascinator for formal events.",$95.00,Image17.png
White Ruffled Waist Midi Skirt,"This crisp white midi skirt offers a blend of comfort and understated elegance. It features a subtly ruffled elasticated waistband, providing a comfortable fit, and practical side pockets. The A-line silhouette ensures a flattering drape and ease of movement, making it a versatile piece for a relaxed yet refined look. Style Vibe: Effortless Chic / Minimalist Casual. Fit: Relaxed A-line, with a comfortable elasticated waist. Material: Lightweight cotton or linen blend. Care: Machine wash cold. Matches Well With: Tops: A tucked-in fitted knit top in a neutral shade, an oversized linen shirt worn casually, or a simple white t-shirt. Outerwear: A light denim jacket or a long, open cardigan. Shoes: Flat sandals, espadrille wedges, or minimalist white sneakers. Accessories: A large woven tote bag or a simple straw sun hat.",$65.00,Image18.png
Burgundy Knit Fit-and-Flare Dress,"This rich burgundy dress is crafted from a comfortable knit fabric with a subtle cable knit texture, offering warmth and dimension. It features a classic scoop neckline and a sleeveless design, with a fitted bodice that flares out into a playful A-line skirt. This dress provides a flattering silhouette that's both cozy and chic. Style Vibe: Cozy Chic / Autumnal Feminine. Fit: Fitted at the bodice and waist, flaring into an A-line skirt. Material: Soft, textured knit (wool or acrylic blend). Care: Hand wash cold, lay flat to dry. Matches Well With: Outerwear: A chunky knit cardigan in a contrasting cream or grey, or a tailored wool coat. Shoes: Ankle boots, knee-high boots, or classic ballet flats. Accessories: A structured satchel bag or a knitted beanie for warmth.",$70.00,Image19.png
Light Blue Pleated Wide-Leg Trousers,"These stylish light blue trousers feature a high-waisted design with elegant pleats that fall into a generous wide-leg silhouette. The soft pastel hue and flowing cut create a sophisticated yet relaxed aesthetic, perfect for adding a touch of serene color to your wardrobe. They offer both comfort and a distinctly fashion-forward look. Style Vibe: Pastel Chic / Modern Minimalist. Fit: High-waisted, wide-leg, with pleats for volume and drape. Material: Smooth, fluid polyester blend. Care: Machine wash cold, gentle cycle. Matches Well With: Tops: A crisp white button-down shirt, a fitted white or cream knit top, or a delicate silk camisole. Outerwear: A tailored light grey blazer or a long, flowing trench coat. Shoes: White sneakers, espadrille wedges, or pointed-toe flats. Accessories: A structured top-handle bag in a light neutral color or a simple fedora hat.",$88.00,Image20.png
Olive Green Midi Pencil Skirt,"This versatile olive green midi skirt features a sleek, body-skimming pencil silhouette that falls to the knee. Its minimalist design and smooth fabric offer a refined yet comfortable fit, making it a foundational piece for various outfits, from casual to smart-casual. Style Vibe: Minimalist Chic / Everyday Essential. Fit: Fitted pencil silhouette, designed to hug the curves. Material: Smooth, stretchy jersey or Ponte knit blend. Care: Machine wash cold. Matches Well With: Tops: A tucked-in white long-sleeve tee for a clean look, a fitted black turtleneck, or a relaxed-fit silk blouse. Outerwear: A tailored blazer or a long, open cardigan. Shoes: Ankle boots, pointed-toe flats, or minimalist heels. Accessories: A structured shoulder bag or a simple leather tote.",$50.00,Image21.png
Sunny Yellow Linen Shirt,"This vibrant sunny yellow linen shirt is designed for a relaxed and airy fit, perfect for warm weather. It features a classic collar and a single chest pocket, with the ability to be styled loosely or tucked in. The breathable linen fabric ensures comfort and a casually sophisticated look. Style Vibe: Resort Casual / Effortless Summer. Fit: Relaxed, slightly oversized. Material: Lightweight and breathable linen. Care: Machine wash cold, hang to dry. Matches Well With: Bottoms: Matching linen trousers (as implied), white denim jeans, or tailored chino shorts. Inner Tops: A simple white camisole or tank top if worn unbuttoned. Shoes: Flat sandals, espadrille wedges, or boat shoes. Accessories: A large straw beach bag or a wide-brimmed sun hat.",$65.00,Image22.png
White Ribbed Cutout Long-Sleeve Top,"This edgy white long-sleeve top features a unique design with strategic cutouts at the shoulders and chest, creating a bold and contemporary silhouette. Made from a comfortable ribbed knit, it offers a snug fit that highlights the figure. The high neckline adds a touch of modern minimalism. Style Vibe: Urban Chic / Edgy Casual. Fit: Tight-fitting, cropped. Material: Stretchy ribbed knit (cotton blend). Care: Machine wash cold, gentle cycle. Matches Well With: Bottoms: High-waisted jeans, cargo pants, or track pants (as shown). Outerwear: An oversized denim jacket or a bomber jacket. Shoes: Chunky sneakers, combat boots, or platform shoes. Accessories: A mini shoulder bag or a slouchy beanie.",$40.00,Image23.png
Pink Distressed Star Jeans,"These playful pink jeans put a unique spin on classic denim with their distressed detailing and eye-catching star-shaped cutouts, revealing frayed edges. The wide-leg, baggy fit offers a comfortable and fashion-forward silhouette, perfect for a bold and rebellious style. Style Vibe: Y2K / Grunge Revival. Fit: Baggy, wide-leg. Material: Distressed cotton denim. Care: Machine wash cold, inside out. Matches Well With: Tops: A cropped black t-shirt (as shown), an oversized band tee, or a fitted tank top. Outerwear: A cropped puffer jacket or a denim vest. Shoes: Chunky sneakers (as shown), platform boots, or skater shoes. Accessories: A beanie or a mini backpack.",$75.00,Image24.png
